<?xml version="1.0" encoding="UTF-8"?>
<xs:schema xmlns:xs="http://www.w3.org/2001/XMLSchema">
    <xs:element name="ikasleak">
        <xs:complexType>
            <xs:sequence>
                <xs:element name="ikaslea" maxOccurs="unbounded">
                    <xs:complexType>
                        <xs:sequence>
                            <xs:element name="nan" type="xs:string"/>
                            <xs:element name="izena" type="xs:string"/>
                            <xs:element name="helbidea">
                                <xs:complexType>
                                    <xs:sequence>
                                        <xs:element name="kalea" type="xs:string"/>
                                        <xs:element name="zbk" type="xs:integer"/>
                                        <xs:element name="herria" type="xs:string"/>
                                        <xs:element name="probintzia" type="xs:string"/>
                                    </xs:sequence>
                                </xs:complexType>
                            </xs:element>
                            <xs:choice>
                                <xs:element name="telefonoa" type="xs:string" minOccurs="0"/>
                                <xs:element name="mugikorra" type="xs:string" minOccurs="3" maxOccurs="3"/>
                            </xs:choice>
                            <xs:element name="emaila" type="xs:string"/>
                        </xs:sequence>
                    </xs:complexType>
                </xs:element>
            </xs:sequence>
        </xs:complexType>
    </xs:element>
</xs:schema>